{
  "$schema": "../templates/sprint.schema.json",
  "schema_version": "sprint-v3",
  "sprint_id": "S01",
  "created": "",
  "branch_strategy": "sequential",
  "base_branch": "main",
  "current_feature": null,
  "features": [],
  "stats": {
    "total": 0,
    "pending": 0,
    "in_progress": 0,
    "in_review": 0,
    "completed": 0,
    "blocked": 0
  },
  "last_updated": "",
  "last_updated_by": null
}
